scale,raw_score,score,percentile,range,ci_95,test,test_name,domain,subdomain,narrow,pass,verbal,timed,test_type,score_type,absort,description,result,scaled_score,t_score,reliability,composition
General Ability,,91,27,Average,83-99,index,Composite Scores,Intelligence/General Ability,General Intelligence,General Intelligence,,,,npsych_test,standard_score,index_general ability_1,An estimate of higher cognitive reasoning and acquired knowledge (*g*),"An estimate of higher cognitive reasoning and acquired knowledge (*g*) was Average and ranked at the 27th percentile, indicating performance as good as or better than 27% of same-age peers from the general population.",8,44,0.92,Similarities & Matrix Reasoning
Crystallized Knowledge,,93,32,Average,80-108,index,Composite Scores,Intelligence/General Ability,General Intelligence,Crystallized Intelligence,,Verbal,Untimed,npsych_test,standard_score,index_crystallized knowledge_2,Crystallized intelligence (*G*c),Crystallized intelligence (*G*c) was classified as Average and ranked at the 32th percentile.,9,45,0.77,Similarities & Naming
Fluid Reasoning,,92,30,Average,81-104,index,Composite Scores,Intelligence/General Ability,General Intelligence,Fluid Intelligence,,Nonverbal,Timed,npsych_test,standard_score,index_fluid reasoning_3,An estimate of fluid intelligence (*G*f),An estimate of fluid intelligence (*G*f) was classified as Average.,8,45,0.85,Matrix Reasoning & Design Construction
Cognitive Proficiency,,97,42,Average,90-104,index,Composite Scores,Intelligence/General Ability,Cognitive Proficiency,Cognitive Proficiency Index,,,,npsych_test,standard_score,index_cognitive proficiency_4,"A composite estimate of working memory^[(ref:working-memory)] and processing speed^[(ref:processing-speed)] (i.e., cognitive proficiency)","A composite estimate of working memory^[(ref:working-memory)] and processing speed^[(ref:processing-speed)] (i.e., cognitive proficiency) was Average and a relative strength|weakness.",9,48,0.94,"Coding, Digits Forward, Digits Backward, & Letter-Number Sequencing"
Processing Speed,,98,45,Average,92-104,index,Composite Scores,Intelligence/General Ability,Cognitive Proficiency,Processing Speed Index,,Nonverbal,Timed,npsych_test,standard_score,index_processing speed_5,Collective performance across measures of processing speed and cognitive efficiency^[(ref:processing-speed)],Collective performance across measures of processing speed and cognitive efficiency^[(ref:processing-speed)] was Average and a relative strength|weakness.,10,49,0.95,"Coding, Numbers & Letters Speed A, Numbers & Letters Efficiency A, & Trails A"
Working Memory,,98,45,Average,91-105,index,Composite Scores,Intelligence/General Ability,Cognitive Proficiency,Working Memory Index,,Verbal,Untimed,npsych_test,standard_score,index_working memory_6,An estimate of working memory capacity^[(ref:working-memory)],An estimate of working memory capacity^[(ref:working-memory)] fell in the Average range and was and a relative strength|weakness.,10,49,0.94,"Digits Forward, Digits Backward, & Letter-Number Sequencing"